<?xml version="1.0" encoding="UTF-8"?>
<!--
To change this license header, choose License Headers in Project Properties.
To change this template file, choose Tools | Templates
and open the template in the editor.
-->


<Component
    xmlns:xsi='http://www.w3.org/2001/XMLSchema-instance'
    xsi:noNamespaceSchemaLocation='BaseComponentSchema.xsd'>
    <Id></Id>
    <Name></Name>
    <Description></Description>
    <InputVariable>
        <Id></Id>
        <Name></Name>
        <Properties Type="" Value=""></Properties>
    </InputVariable>
    <OutputVariable>
        <Id></Id>
        <Name></Name>
        <Properties Type="" Value=""></Properties>
    </OutputVariable>
    <State>
        <Id></Id>
        <Name></Name>
        <Initial></Initial>
    </State>
    <State>
        <Id></Id>
        <Name></Name>
        <Initial></Initial>
    </State>
    <State>
        <Id></Id>
        <Name></Name>
        <Initial></Initial>
    </State>
    <Transition>
        <Id></Id>
        <Name></Name>
        <Properties Source="" Target="" Type="">
            <Guard></Guard>
            <Event></Event>
            <Action></Action>
            <TimeFunction Type="" Value="" Unit=""></TimeFunction>
        </Properties>
    </Transition>
    <Transition>
        <Id></Id>
        <Name></Name>
        <Properties Source="" Target="" Type="">
            <Guard></Guard>
            <Event></Event>
            <Action></Action>
            <TimeFunction Type="" Value="" Unit=""></TimeFunction>
        </Properties>
    </Transition>
    <Transition>
        <Id></Id>
        <Name></Name>
        <Properties Source="" Target="" Type="">
            <Guard></Guard>
            <Event></Event>
            <Action></Action>
            <TimeFunction Type="" Value="" Unit=""></TimeFunction>
        </Properties>
    </Transition>

</Component>
